地名,x,y,介绍,人物
东海,345,177,现地址：山东临沂市郯城县西北。秦置，楚、汉之际也称郯郡。故治郯。西汉辖境相当于今山东费城县、临沂至江苏赣榆以南，山东枣庄、江苏邳县以东和江苏宿迁、灌南以北地区。王莽时改郡名曰沂平。东汉时一度改为封国，辖境也有所缩小。,
东莞,342,173,现地址：山东临沂市沂水县。汉建安初分琅玡、齐郡地置。三国魏同。辖境相当今山东临朐、沂源、蒙阴、沂水、沂南等地。,
广陵,356,217,现地址：江苏扬州市西北。西汉元狩三年（前120）改江都国置广陵国。治所在广陵（今扬州）。辖境相当今江苏长江以北、射阳湖西南、仪征以东地区。东汉建武中改为郡。三国魏移治淮阴（今清江）。辖境相当今洪泽湖、泗阳、天长一线以东，灌云以南，高邮、东台以北，串场河以西地。,
琅邪,347,175,现地址：山东临沂市诸城。春秋齐地，秦为琅邪郡治所。西汉属琅邪郡，东汉改郡为国。春秋末越王勾践灭吴，欲北上称霸，迁都于此。,
彭城,334,192,现地址：江苏徐州市。西汉地节元年（前69）改楚国为彭城郡。不久复改为国。东汉章和二年（88）改为彭城国。治所在彭城（今江苏徐州）。辖境相当今山东徽山、江苏徐州、铜山、沛县东南部。,
下邳,335,190,现地址：江苏徐州市睢宁县西北古邳镇东。秦置。汉、魏历为徐州、下邳国、下邳郡等治所。位沂、泗两水交汇处，自古常为淮北战场。汉末刘备为徐州牧屯此，为吕布所袭取。其后曹操攻吕布，城破，斩布于南门白门楼下。,
